{
  "schema_version": 1,
  "kind": "docker_node_snapshot",
  "agent_id": "local-dev-node",
  "node_name": "Local Dev Node",
  "observed_at": "2026-03-24T17:58:36Z",
  "services": [
    {
      "container_id": "df4c1db96f2b",
      "container_name": "examples-app-1",
      "service_name": "app",
      "image": "docker.io/library/nginx:1.27-alpine",
      "image_name": "docker.io/library/nginx",
      "image_tag": "1.27-alpine",
      "detected_version": "1.27-alpine",
      "detected_version_source": "image_tag",
      "state": "running",
      "running": true,
      "status": "Up Less than a second",
      "observed_via": "docker_engine",
      "project_name": "examples"
    },
    {
      "container_id": "3edfcee43e30",
      "container_name": "examples-mqtt-1",
      "service_name": "mqtt",
      "image": "docker.io/library/eclipse-mosquitto:2",
      "image_name": "docker.io/library/eclipse-mosquitto",
      "image_tag": "2",
      "detected_version": "2.1.2",
      "detected_version_source": "container_label",
      "state": "running",
      "running": true,
      "status": "Up Less than a second",
      "observed_via": "docker_engine",
      "project_name": "examples",
      "version_label_key": "org.opencontainers.image.version"
    }
  ]
}
